{
  "contract_version": "1.0.0",
  "study_id": "study.mirai-2.technology-adherence.factorial-v1",
  "status": "ready",
  "pilot_independent_task_counts": {
    "federation": 4,
    "larena_code_generation": 4,
    "ai_employee": 4
  },
  "variance_estimates": {
    "technology_adherence": 0.05897988172541744
  },
  "blockers": [],
  "next_action": "Complete independent review of the calibration packet, then freeze and preregister the 30-task-per-domain held-out confirmatory design before collecting outcomes.",
  "claim_boundary": "The task-cluster variance estimate and conservative power simulation support sample-size planning only. They do not constitute confirmatory effectiveness evidence."
}
